{"schema_version":"project-eval-suite/v1","suite_id":"compact-healthy","title":"Routing explanation suite","cases":[{"case_id":"explain-routing","title":"Explain the routing contract","kind":"explanation","importance":"standard","fixture":"fixtures/explain-routing","task":"Explain the one public routing contract and cite its validator.","coverage":"development","platforms":["linux","windows","macos"],"required_capabilities":[],"assertion_ids":["routing","validator"]}],"profiles":{"smoke":{"case_ids":["explain-routing"],"repetitions":1,"max_invocations":1,"max_seconds":30,"max_tokens":5000,"max_cost_usd":null,"network":false,"effects":[]}}}
