{"schema_version":"project-eval-suite/v1","suite_id":"unique-regression","title":"Authentication regression","cases":[{"case_id":"token-replay","title":"Reject revoked-token replay","kind":"implementation","importance":"required","fixture":"fixtures/token-replay","task":"Detect replay of a revoked authentication token.","coverage":"regression","platforms":["linux","windows","macos"],"required_capabilities":[],"assertion_ids":["replay-rejected"]}],"profiles":{"smoke":{"case_ids":["token-replay"],"repetitions":1,"max_invocations":1,"max_seconds":60,"max_tokens":10000,"max_cost_usd":null,"network":false,"effects":["workspace_edit","command_execution"]}}}
