{"schema_version":"project-eval-suite/v1","suite_id":"fixture","title":"Fixture suite","cases":[{"case_id":"retry-basics","title":"Retry basics","kind":"implementation","importance":"standard","fixture":"fixtures/retry","task":"Preserve the current retry mechanism.","coverage":"development","platforms":["linux"],"required_capabilities":[],"assertion_ids":["retry"]}],"profiles":{}}
