{"schema_version":"project-eval-suite/v1","suite_id":"stale-fixture","title":"Versioned API suite","cases":[{"case_id":"api-v1-fixture","title":"Validate the versioned API response","kind":"implementation","importance":"important","fixture":"fixtures/api-v1","task":"The product exposes v2 while this fixture and task still name v1. Validate the current API response contract.","coverage":"regression","platforms":["linux","windows","macos"],"required_capabilities":[],"assertion_ids":["response-validation"]}],"profiles":{"smoke":{"case_ids":["api-v1-fixture"],"repetitions":1,"max_invocations":1,"max_seconds":60,"max_tokens":10000,"max_cost_usd":null,"network":false,"effects":["workspace_edit","command_execution"]}}}
