{"schema_version":"project-eval-suite/v1","suite_id":"fixture","title":"Fixture suite","cases":[{"case_id":"route-manifest","title":"Explain route manifest","kind":"explanation","importance":"important","fixture":"fixtures/route","task":"Explain the route manifest validation contract.","coverage":"development","platforms":["linux","windows","macos"],"required_capabilities":[],"assertion_ids":["route"]}],"profiles":{}}
