{"schema_version":"project-eval-suite/v1","suite_id":"safe-merge","title":"Endpoint behavior suite","cases":[{"case_id":"endpoint-a","title":"Add a validated GET endpoint","kind":"implementation","importance":"important","fixture":"fixtures/endpoint-a","task":"Add a GET endpoint and validate its response.","coverage":"development","platforms":["linux","windows","macos"],"required_capabilities":[],"assertion_ids":["endpoint","response"]},{"case_id":"endpoint-b","title":"Add a named GET endpoint","kind":"implementation","importance":"standard","fixture":"fixtures/endpoint-b","task":"Add a GET endpoint and validate its response using the same harness and assertions.","coverage":"development","platforms":["linux","windows","macos"],"required_capabilities":[],"assertion_ids":["endpoint","response"]}],"profiles":{"smoke":{"case_ids":["endpoint-a","endpoint-b"],"repetitions":1,"max_invocations":2,"max_seconds":120,"max_tokens":20000,"max_cost_usd":null,"network":false,"effects":["workspace_edit","command_execution"]}}}
