{"schema_version":"project-eval-suite/v1","suite_id":"unsafe-retirement","title":"Path-boundary regression suite","cases":[{"case_id":"path-boundary","title":"Reject linked output ancestors","kind":"implementation","importance":"required","fixture":"fixtures/path-boundary","task":"Reject a linked output ancestor without writing outside the selected root.","coverage":"regression","platforms":["linux","windows"],"required_capabilities":[],"assertion_ids":["outside-absent"]}],"profiles":{"smoke":{"case_ids":["path-boundary"],"repetitions":1,"max_invocations":1,"max_seconds":60,"max_tokens":10000,"max_cost_usd":null,"network":false,"effects":["workspace_edit","command_execution"]}}}
