{"schema_version":"project-eval-suite/v1","suite_id":"high-cost-duplicates","title":"Endpoint workflow coverage","cases":[{"case_id":"large-flow-a","title":"Full endpoint workflow A","kind":"trajectory","importance":"important","fixture":"fixtures/large-a","task":"Clarify, design, and implement the standard endpoint workflow.","coverage":"development","platforms":["linux","windows","macos"],"required_capabilities":[],"assertion_ids":["questions","endpoint"]},{"case_id":"large-flow-b","title":"Full endpoint workflow B","kind":"trajectory","importance":"standard","fixture":"fixtures/large-b","task":"Clarify, design, and implement the standard endpoint workflow with the same assertions.","coverage":"development","platforms":["linux","windows","macos"],"required_capabilities":[],"assertion_ids":["questions","endpoint"]}],"profiles":{"full":{"case_ids":["large-flow-a","large-flow-b"],"repetitions":5,"max_invocations":10,"max_seconds":7200,"max_tokens":500000,"max_cost_usd":100,"network":false,"effects":["workspace_edit","command_execution"]}}}
